{
    "schemaVersion":  1,
    "id":  "csharp-linq-top-three-001",
    "version":  1,
    "title":  "Sélectionner les trois plus grands",
    "kind":  "csharp",
    "difficulty":  3,
    "skills":  [
                   "csharp.linq"
               ],
    "prerequisites":  [
                          "generics-delegates-001"
                      ],
    "estimatedMinutes":  30,
    "statement":  "statement.md",
    "constraints":  [
                        "Conserver exactement la signature publique",
                        "Ordonner de façon descendante puis borner sans supprimer les doublons.",
                        "Ne pas modifier les entrées reçues sauf mention explicite"
                    ],
    "examples":  [
                     {
                         "input":  "[[1,5,3,4]]",
                         "output":  "[5,4,3]"
                     }
                 ],
    "reflectionFields":  [
                             "reformulation",
                             "inputs",
                             "expectedOutput",
                             "edgeCases",
                             "hypothesis",
                             "plan"
                         ],
    "starterPath":  "starter/",
    "visibleTestsPath":  "tests/visible/",
    "hiddenTestsPath":  "tests/hidden/",
    "hints":  [
                  {
                      "level":  1,
                      "kind":  "socratic",
                      "content":  "Quel invariant de « Sélectionner les trois plus grands » doit rester vrai pour les cas limites ?"
                  },
                  {
                      "level":  2,
                      "kind":  "location",
                      "content":  "Concentrez la décision dans la méthode TopThree, sans état global."
                  },
                  {
                      "level":  3,
                      "kind":  "strategy",
                      "content":  "Ordonner de façon descendante puis borner sans supprimer les doublons."
                  },
                  {
                      "level":  4,
                      "kind":  "partial-pseudocode",
                      "content":  "si values est null lever ArgumentNullException ; ordonner de façon décroissante ; ne prendre que les trois premiers éléments, sans exiger qu'il y en ait trois ; matérialiser en tableau"
                  }
              ],
    "solution":  {
                     "path":  "solution/",
                     "unlock":  {
                                    "seriousAttempts":  2,
                                    "minimumDelayMinutes":  10
                                }
                 },
    "explanation":  "explanation.md",
    "complexity":  "O(n log n) en temps et O(n) en espace",
    "commonMistakes":  [
                           "Retirer les doublons alors que le contrat conserve les valeurs répétées",
                           "Lever quand la collection contient moins de trois éléments",
                           "Ordonner de façon croissante et retourner les trois valeurs dans le mauvais ordre",
                           "Retourner la séquence paresseuse sans la matérialiser"
                       ],
    "variantId":  "csharp-csv-field-count-001",
    "reviewCards":  [
                        "card-csharp-linq-top-three-001-rule",
                        "card-csharp-linq-top-three-001-edge"
                    ],
    "interviewQuestionId":  "interview-csharp-linq-top-three-001",
    "license":  "CC-BY-4.0"
}
