{
    "schemaVersion":  1,
    "id":  "csharp-nullable-fallback-001",
    "version":  1,
    "title":  "Choisir une valeur de repli",
    "kind":  "csharp",
    "difficulty":  1,
    "skills":  [
                   "csharp.nullable"
               ],
    "prerequisites":  [
                          "oop-encapsulation-001"
                      ],
    "estimatedMinutes":  30,
    "statement":  "statement.md",
    "constraints":  [
                        "Conserver exactement la signature publique",
                        "Une absence attendue reçoit un repli explicite, distinct d’une erreur métier.",
                        "Ne pas modifier les entrées reçues sauf mention explicite"
                    ],
    "examples":  [
                     {
                         "input":  "[{\"value\":[\" ok \"],\"Count\":1},\"ok\"]",
                         "output":  "[{\"value\":[\"\"],\"Count\":1},\"n/a\"]"
                     }
                 ],
    "reflectionFields":  [
                             "reformulation",
                             "inputs",
                             "expectedOutput",
                             "edgeCases",
                             "hypothesis",
                             "plan"
                         ],
    "starterPath":  "starter/",
    "visibleTestsPath":  "tests/visible/",
    "hiddenTestsPath":  "tests/hidden/",
    "hints":  [
                  {
                      "level":  1,
                      "kind":  "socratic",
                      "content":  "Quel invariant de « Choisir une valeur de repli » doit rester vrai pour les cas limites ?"
                  },
                  {
                      "level":  2,
                      "kind":  "location",
                      "content":  "Concentrez la décision dans la méthode Fallback, sans état global."
                  },
                  {
                      "level":  3,
                      "kind":  "strategy",
                      "content":  "Une absence attendue reçoit un repli explicite, distinct d’une erreur métier."
                  },
                  {
                      "level":  4,
                      "kind":  "partial-pseudocode",
                      "content":  "valider les bornes ; parcourir ou décider ; retourner un nouveau résultat déterministe"
                  }
              ],
    "solution":  {
                     "path":  "solution/",
                     "unlock":  {
                                    "seriousAttempts":  2,
                                    "minimumDelayMinutes":  10
                                }
                 },
    "explanation":  "explanation.md",
    "complexity":  "O(n) en temps et O(n) en espace",
    "commonMistakes":  [
                           "Coder uniquement les exemples visibles",
                           "Oublier une borne ou modifier une entrée",
                           "Annoncer une complexité sans compter les opérations dominantes"
                       ],
    "variantId":  "csharp-positive-quantity-001",
    "reviewCards":  [
                        "card-csharp-nullable-fallback-001-rule",
                        "card-csharp-nullable-fallback-001-edge"
                    ],
    "interviewQuestionId":  "interview-csharp-nullable-fallback-001",
    "license":  "CC-BY-4.0"
}
