{
    "schemaVersion":  1,
    "id":  "tests-quantity-rule-001",
    "version":  1,
    "title":  "Tester une règle de quantité",
    "kind":  "csharp",
    "difficulty":  2,
    "skills":  [
                   "tests.domain"
               ],
    "prerequisites":  [
                          "tests-xunit-aaa-001"
                      ],
    "estimatedMinutes":  35,
    "statement":  "statement.md",
    "constraints":  [
                        "Conserver exactement la signature publique",
                        "Exprimer directement la plage inclusive pour rendre ses quatre frontières testables.",
                        "Ne jamais dépendre du réseau, d’un secret réel ou d’un état global"
                    ],
    "examples":  [
                     {
                         "input":  "[{\"value\":[1],\"Count\":1},true]",
                         "output":  "[{\"value\":[0],\"Count\":1},false]"
                     }
                 ],
    "reflectionFields":  [
                             "reformulation",
                             "inputs",
                             "expectedOutput",
                             "edgeCases",
                             "hypothesis",
                             "plan"
                         ],
    "starterPath":  "starter/",
    "visibleTestsPath":  "tests/visible/",
    "hiddenTestsPath":  "tests/hidden/",
    "hints":  [
                  {
                      "level":  1,
                      "kind":  "socratic",
                      "content":  "Quel comportement public de « Tester une règle de quantité » change exactement à la frontière ?"
                  },
                  {
                      "level":  2,
                      "kind":  "location",
                      "content":  "Concentrez la validation et la décision dans IsValidQuantity, sans état global ni journal sensible."
                  },
                  {
                      "level":  3,
                      "kind":  "strategy",
                      "content":  "Exprimer directement la plage inclusive pour rendre ses quatre frontières testables."
                  },
                  {
                      "level":  4,
                      "kind":  "partial-pseudocode",
                      "content":  "valider les entrées ; appliquer la décision bornée ; retourner un résultat déterministe sans effet externe"
                  }
              ],
    "solution":  {
                     "path":  "solution/",
                     "unlock":  {
                                    "seriousAttempts":  2,
                                    "minimumDelayMinutes":  10
                                }
                 },
    "explanation":  "explanation.md",
    "complexity":  "O(1) en temps et O(1) en espace",
    "commonMistakes":  [
                           "Coder seulement les exemples visibles",
                           "Masquer une erreur ou accepter une entrée hors contrat",
                           "Confondre une règle pure avec le transport ou une ressource externe"
                       ],
    "variantId":  "tests-shipping-theory-001",
    "reviewCards":  [
                        "card-tests-quantity-rule-001-rule",
                        "card-tests-quantity-rule-001-security"
                    ],
    "interviewQuestionId":  "interview-tests-quantity-rule-001",
    "license":  "CC-BY-4.0"
}
