{
  "schemaVersion": 1,
  "id": "observability-trace-stitch-001",
  "version": 1,
  "title": "Compter les segments de trace orphelins d'un journal",
  "kind": "csharp",
  "difficulty": 3,
  "skills": ["observability.correlation"],
  "prerequisites": ["observability-correlation-001"],
  "estimatedMinutes": 30,
  "statement": "statement.md",
  "constraints": [
    "Conserver exactement la signature publique",
    "Un segment racine, marqué par le tiret, n'est jamais orphelin",
    "Un segment qui se déclare son propre parent est orphelin",
    "Un identifiant de segment répété rend le journal inexploitable"
  ],
  "examples": [
    {
      "input": "a1>-;b2>a1;c3>a1",
      "output": "0"
    },
    {
      "input": "root>-;child>root;ghost>lost;stray>gone",
      "output": "2"
    }
  ],
  "reflectionFields": [
    "reformulation",
    "inputs",
    "expectedOutput",
    "edgeCases",
    "hypothesis",
    "plan"
  ],
  "starterPath": "starter/",
  "visibleTestsPath": "tests/visible/",
  "hiddenTestsPath": "tests/hidden/",
  "hints": [
    {
      "level": 1,
      "kind": "socratic",
      "content": "La cascade d'une requête s'arrête net au milieu de l'écran alors que le service aval a bel et bien travaillé. Qu'est-ce qui a pu se perdre entre les deux services pour que leurs segments ne se recousent plus ?"
    },
    {
      "level": 2,
      "kind": "location",
      "content": "Le comptage exige deux passages : le premier construit l'ensemble des identifiants connus en refusant les doublons, le second seul peut juger les parents — un parent déclaré avant son enfant est parfaitement légal."
    },
    {
      "level": 3,
      "kind": "strategy",
      "content": "Trois situations font un orphelin ou non : le tiret désigne une racine assumée, un parent présent dans l'ensemble recoud le segment, et tout le reste — parent inconnu ou segment qui se cite lui-même — compte comme orphelin."
    },
    {
      "level": 4,
      "kind": "partial-pseudocode",
      "content": "refuser un journal vide ; découper les segments et refuser toute entrée sans séparateur ou aux identifiants vides ; remplir l'ensemble des identifiants en refusant les répétitions ; repasser sur les segments : ignorer les racines, compter un orphelin quand le parent est l'identifiant lui-même ou qu'il manque à l'ensemble ; rendre le compte"
    }
  ],
  "solution": {
    "path": "solution/",
    "unlock": {
      "seriousAttempts": 2,
      "minimumDelayMinutes": 10
    }
  },
  "explanation": "explanation.md",
  "complexity": "O(n) en temps pour n segments et O(n) en espace pour l'ensemble des identifiants",
  "commonMistakes": [
    "Juger les parents en un seul passage et compter orphelin tout enfant déclaré avant son parent",
    "Traiter la racine comme un orphelin parce que son parent n'est pas un identifiant du journal",
    "Laisser passer le segment qui se déclare son propre parent au motif que l'identifiant existe",
    "Écraser un identifiant répété au lieu de refuser un journal qui ne peut plus être recousu"
  ],
  "variantId": "azure-correlation-signal-001",
  "reviewCards": [
    "card-observability-trace-stitch-001-rule",
    "card-observability-trace-stitch-001-edge"
  ],
  "interviewQuestionId": "interview-observability-trace-stitch-001",
  "license": "CC-BY-4.0"
}
