{
    "schemaVersion":  1,
    "id":  "security-refresh-rotation-001",
    "version":  1,
    "title":  "Calculer la fenêtre de rotation d'un rafraîchissement",
    "kind":  "csharp",
    "difficulty":  3,
    "skills":  [
                   "security.token"
               ],
    "prerequisites":  [
                          "oidc-identity-001"
                      ],
    "estimatedMinutes":  30,
    "statement":  "statement.md",
    "constraints":  [
                        "Conserver exactement la signature publique",
                        "La session expirée rend zéro, jamais une durée négative ni une exception",
                        "L'arithmétique des instants se fait en 64 bits avant toute comparaison"
                    ],
    "examples":  [
                     {
                         "input":  "[1750010000, 1749990000, 3600]",
                         "output":  "3600"
                     }
                 ],
    "reflectionFields":  [
                             "reformulation",
                             "inputs",
                             "expectedOutput",
                             "edgeCases",
                             "hypothesis",
                             "plan"
                         ],
    "starterPath":  "starter/",
    "visibleTestsPath":  "tests/visible/",
    "hiddenTestsPath":  "tests/hidden/",
    "hints":  [
                  {
                      "level":  1,
                      "kind":  "socratic",
                      "content":  "Deux horloges bornent chaque jeton tourné : laquelle gagne quand la fin de session approche, et pourquoi la fenêtre ne doit-elle jamais la dépasser ?"
                  },
                  {
                      "level":  2,
                      "kind":  "location",
                      "content":  "Après la validation du glissement, tout tient dans une soustraction d'instants et un minimum — le reste est du soin apporté aux bornes."
                  },
                  {
                      "level":  3,
                      "kind":  "strategy",
                      "content":  "Traitez la session déjà finie comme un résultat ordinaire — la fenêtre nulle — et non comme une erreur : seule la durée de glissement non positive est une faute de l'appelant."
                  },
                  {
                      "level":  4,
                      "kind":  "partial-pseudocode",
                      "content":  "lever si la durée de glissement n'est pas strictement positive ; si l'instant courant atteint ou dépasse l'échéance absolue, rendre zéro ; calculer le reste de session en 64 bits ; rendre le plus petit entre ce reste et la durée de glissement"
                  }
              ],
    "solution":  {
                     "path":  "solution/",
                     "unlock":  {
                                    "seriousAttempts":  2,
                                    "minimumDelayMinutes":  10
                                }
                 },
    "explanation":  "explanation.md",
    "complexity":  "O(1) en temps et en espace",
    "commonMistakes":  [
                           "Rendre le reste de session négatif au lieu de zéro quand l'échéance absolue est passée",
                           "Laisser la dernière fenêtre déborder l'échéance absolue en rendant toujours la durée de glissement",
                           "Lever sur la session expirée alors que c'est un état ordinaire du cycle de vie",
                           "Soustraire les instants en 32 bits et déborder sur des écarts extrêmes"
                       ],
    "variantId":  "security-oauth-state-001",
    "reviewCards":  [
                        "card-security-refresh-rotation-001-rule",
                        "card-security-refresh-rotation-001-edge"
                    ],
    "interviewQuestionId":  "interview-security-refresh-rotation-001",
    "license":  "CC-BY-4.0"
}
