{
    "schemaVersion":  1,
    "id":  "algo-rotate-left-001",
    "version":  1,
    "title":  "Faire tourner un tableau",
    "kind":  "algorithm",
    "difficulty":  2,
    "skills":  [
                   "algorithm.arrays"
               ],
    "prerequisites":  [
                          "algo-reformulation-complexity-001"
                      ],
    "estimatedMinutes":  30,
    "statement":  "statement.md",
    "constraints":  [
                        "Conserver exactement la signature publique",
                        "Normaliser le décalage, y compris négatif, avant l’index modulo.",
                        "Ne pas modifier les entrées reçues sauf mention explicite"
                    ],
    "examples":  [
                     {
                         "input":  "[[1,2,3],1]",
                         "output":  "[2,3,1]"
                     }
                 ],
    "reflectionFields":  [
                             "reformulation",
                             "inputs",
                             "expectedOutput",
                             "edgeCases",
                             "hypothesis",
                             "plan"
                         ],
    "starterPath":  "starter/",
    "visibleTestsPath":  "tests/visible/",
    "hiddenTestsPath":  "tests/hidden/",
    "hints":  [
                  {
                      "level":  1,
                      "kind":  "socratic",
                      "content":  "Quel invariant de « Faire tourner un tableau » doit rester vrai pour les cas limites ?"
                  },
                  {
                      "level":  2,
                      "kind":  "location",
                      "content":  "Concentrez la décision dans la méthode RotateLeft, sans état global."
                  },
                  {
                      "level":  3,
                      "kind":  "strategy",
                      "content":  "Normaliser le décalage, y compris négatif, avant l’index modulo."
                  },
                  {
                      "level":  4,
                      "kind":  "partial-pseudocode",
                      "content":  "si le tableau est vide retourner un résultat vide ; ramener le décalage dans l'intervalle de la longueur, en traitant aussi les valeurs négatives ; allouer un résultat de la même longueur et y écrire, pour chaque indice, la valeur lue à l'indice décalé pris modulo la longueur"
                  }
              ],
    "solution":  {
                     "path":  "solution/",
                     "unlock":  {
                                    "seriousAttempts":  2,
                                    "minimumDelayMinutes":  10
                                }
                 },
    "explanation":  "explanation.md",
    "complexity":  "O(n) en temps et O(n) en espace",
    "commonMistakes":  [
                           "Ne pas ramener le décalage modulo la longueur et parcourir inutilement",
                           "Obtenir un reste négatif sur un décalage négatif et sortir de l'intervalle",
                           "Diviser par la longueur avant d'avoir traité le tableau vide",
                           "Écrire dans le tableau reçu et écraser des valeurs encore nécessaires"
                       ],
    "variantId":  "algo-merge-sorted-001",
    "reviewCards":  [
                        "card-algo-rotate-left-001-rule",
                        "card-algo-rotate-left-001-edge"
                    ],
    "interviewQuestionId":  "interview-algo-rotate-left-001",
    "license":  "CC-BY-4.0"
}
